{
  "required" : true ,
  "$schema" : "http://json-schema.org/draft-03/schema" ,
  "type" : "object" ,
  "properties" : {
    "kind" : {
      "type" : "string" ,
      "required" : false
    } ,
    "etag" : {
      "type" : "string" ,
      "required" : false
    } ,
    "nextPageToken" : {
      "type" : "string" ,
      "required" : false
    } ,
    "nextSyncToken" : {
      "type" : "string" ,
      "required" : false
    } ,
    "items" : {
      "type" : "array" ,
      "required" : false ,
      "items" : [
        {
          "type" : "object" ,
          "properties" : {
            "kind" : {
              "type" : "string" ,
              "required" : false
            } ,
            "etag" : {
              "type" : "string" ,
              "required" : false
            } ,
            "id" : {
              "type" : "string" ,
              "required" : false
            } ,
            "scope" : {
              "type" : "object" ,
              "required" : false ,
              "properties" : {
                "type" : {
                  "type" : "string" ,
                  "required" : false
                } ,
                "value" : {
                  "type" : "string" ,
                  "required" : false
                }
              }
            } ,
            "role" : {
              "type" : "string" ,
              "required" : false
            }
          }
        }
      ]
    }
  }
}