{
  "kind" : "calendar#calendarList" ,
  "etag" : "etag" ,
  "nextPageToken" : "string" ,
  "nextSyncToken" : "string" ,
  "items" : [
    {
      "kind" : "calendar#calendarListEntry" ,
      "etag" : "etag" ,
      "id" : "string" ,
      "summary" : "string" ,
      "description" : "string" ,
      "location" : "string" ,
      "timeZone" : "string" ,
      "summaryOverride" : "string" ,
      "colorId" : "string" ,
      "backgroundColor" : "string" ,
      "foregroundColor" : "string" ,
      "hidden" : "boolean" ,
      "selected" : "boolean" ,
      "accessRole" : "string" ,
      "defaultReminders" : [
        {
          "method" : "string" ,
          "minutes" : "integer"
        }
      ] ,
      "notificationSettings" : {
        "notifications" : [
          {
            "type" : "string" ,
            "method" : "string"
          }
        ]
      } ,
      "primary" : "boolean" ,
      "deleted" : "boolean"
    }
  ]
}